content,bank,quarter,conversation_id,type,speaker_name,speaker_role,speaker_company
"I think one thing that's worth noting though is that if you wind up in the state of the world where bank deposits drain sooner than people might have otherwise thought, in all likelihood, that's going to be the lower value, non-operating type deposits. So in any case, we'll see.",JPM,20221,5.0,A,Jeremy Barnum,Chief Financial Officer,JPMorgan Chase & Co.
"But to simplify it for a second, our base case remains modest growth and deposits for us as a company and just pivoting away for a second from the system to us. From a share perspective, we've taken share in retail deposits, and we feel great about that. And in wholesale, we've had some nice wins and a nice pipeline of deals there. So that's the current thinking on that topic. ",JPM,20221,5.0,A,Jeremy Barnum,Chief Financial Officer,JPMorgan Chase & Co.
"So the answer is we don't know, okay. And you guys should read economists' reports, but the fact is initially it probably won't come out of deposits. Over time, it will come out of wholesale and then maybe consumer. We're prepared for that. It doesn't actually mean that much to us in the short run. And the beta effectively, we don't expect to be different from what it was in the past. There are a lot of pluses and minuses. You can argue a whole bunch of different ways, but the fact is it won't be that much different, at least the first 100 basis point increase. ",JPM,20221,5.0,A,Jamie Dimon,Chairman & Chief Executive Officer,JPMorgan Chase & Co.
"No, that's really helpful color. Thanks for allowing us to nerd out with you guys on that. Just one more topic or follow up, I should say. Jamie, just in the shareholder letter, you had spoken about how the market is underestimating the number of Fed hikes that might be needed to curb inflation. What's your expectation around the level of Fed tightening? I know it's difficult to make such predictions, but maybe if you could just help us understand given your own rate outlook how that's informing how you're managing excess liquidity, given the significant capacity that you have to redeploy some of those proceeds into higher yielding securities. ",JPM,20221,5.0,Q,Steven Chubak,Analyst,Wolfe Research LLC
"Yeah. So I think the implied curve now is like 2.5% at the end of the year and maybe 3% at the end of 2023. Look, no one knows. Obviously, everyone does their forecast. I think it's going to be more than that, okay. I'll give you a million different reasons why because of inflation, and we just talked about deposits. And we've never been through, ever, QT like this. So this is a new thing for the world. And I think it's more substantially important than other people think because the huge change of flows of funds is going to create as people change their investment portfolios. We're going to be fine because we're going to serve the hell out of our customers and gain share.",JPM,20221,5.0,A,Jamie Dimon,Chairman & Chief Executive Officer,JPMorgan Chase & Co.
"So what does it do for JPMorgan Chase? JPMorgan Chase will be fine. We have plenty of capital, plenty of growth – we have great margins. We already have the returns we want and all the things like that. So I would just be cautious, I think we should expect these volatile markets. Again, that's okay for us. And the Fed – we just think the Fed needs to do what they need to do to try to manage this economy and try to get to a soft landing if possible. ",JPM,20221,5.0,A,Jamie Dimon,Chairman & Chief Executive Officer,JPMorgan Chase & Co.
And any appetite to deploy the excess liquidity? ,JPM,20221,5.0,Q,Steven Chubak,Analyst,Wolfe Research LLC
"No, don’t expect that. ",JPM,20221,5.0,A,Jamie Dimon,Chairman & Chief Executive Officer,JPMorgan Chase & Co.
Yeah. Okay. Yeah we can leave it there. ,JPM,20221,5.0,A,Jeremy Barnum,Chief Financial Officer,JPMorgan Chase & Co.
Okay. Thanks so much. ,JPM,20221,5.0,Q,Steven Chubak,Analyst,Wolfe Research LLC
"Hi. Thank you. I wonder if you could talk through the changes in the macro assumptions to capture that downside risk in CECL assumptions. What I want to get to is where we came from, where we're at now, and then we can impose our thoughts on each quarter as we go... ",JPM,20221,6.0,Q,Glenn Schorr,Analyst,Evercore ISI
"Yeah. Guys, I don't want to spend a lot of time on CECL, okay. I think it's a complete waste of time. Basically, all we said is the chance of a adverse or severe adverse event is 10% higher than it was before. That's all we did, very basic. And that led to... ",JPM,20221,6.0,A,Jamie Dimon,Chairman & Chief Executive Officer,JPMorgan Chase & Co.
"It really is that simple, Glenn. ",JPM,20221,6.0,A,Jeremy Barnum,Chief Financial Officer,JPMorgan Chase & Co.
"And we don't know – and it's a guess. It's probability weighted, hypothetical, multiyear scenarios that we do the best we can, but to spend a lot of time on earnings calls about CECL swings is a waste of time. It's got nothing to do with the underlying business.",JPM,20221,6.0,A,Jamie Dimon,Chairman & Chief Executive Officer,JPMorgan Chase & Co.
"Charge-offs are extraordinarily good, as a matter of fact, way better than they should be. I mean, middle market 1 basis point; Credit Card 1.5. We would have told you in the past that the best they'll ever be is 2.5. So credit's very good. That'll get worse. NII is going to get much better. Things are going to normalize. We're still earning 16% or 17% on tangible equity. And obviously, you have really – yeah. ",JPM,20221,6.0,A,Jamie Dimon,Chairman & Chief Executive Officer,JPMorgan Chase & Co.
Yeah. The 10% is what I wanted because your guess is better than my guess. So I appreciate that. ,JPM,20221,6.0,Q,Glenn Schorr,Analyst,Evercore ISI
"Glenn, with all due respect, I do not believe it is. ",JPM,20221,6.0,A,Jamie Dimon,Chairman & Chief Executive Officer,JPMorgan Chase & Co.
"Okay. We'll have a pinky bet. So I think you might have just answered, but I want to make sure I ask it explicitly. The follow up I have on credit, and I know it's in much better shape and it depends on the go forward, but are you seeing any stresses in the levered parts of the debt markets, meaning levered loans, high-yield, CLO, private credit? Anything in there that makes you turn a side eye? ",JPM,20221,6.0,Q,Glenn Schorr,Analyst,Evercore ISI
Just spread widening and a little bit less liquidity. ,JPM,20221,6.0,A,Jamie Dimon,Chairman & Chief Executive Officer,JPMorgan Chase & Co.
That doesn’t sound so bad. ,JPM,20221,6.0,Q,Glenn Schorr,Analyst,Evercore ISI
"Yeah. No. I mean, Glenn, I think, look, no one likes to be complacent about this type of stuff. And obviously, in this environment, everyone's looking very closely everywhere for any risks and trying to see around the corner. But as of right now, we're really not seeing anything of concern in the kind of spot metrics, so to speak. ",JPM,20221,6.0,A,Jeremy Barnum,Chief Financial Officer,JPMorgan Chase & Co.
"Maybe the last quickie on credit is just with everybody having a job and there's wage inflation and excess cash, are there any buckets of the income that you're seeing the early-stage delinquencies picking up? ",JPM,20221,6.0,Q,Glenn Schorr,Analyst,Evercore ISI
"In short, no. It is an interesting question as you look across our customer base, particularly in Card, and sort of the heavily debated question of real income growth and gas prices and what's that doing to consumer balance sheets. And so we're watching that, especially in the kind of LMI segment of our customer base, but right now we're not actually seeing anything that gives us reason to worry. ",JPM,20221,6.0,A,Jeremy Barnum,Chief Financial Officer,JPMorgan Chase & Co.
Okay. Thank you for all that. ,JPM,20221,6.0,Q,Glenn Schorr,Analyst,Evercore ISI
"Thanks, Glenn. ",JPM,20221,6.0,A,Jeremy Barnum,Chief Financial Officer,JPMorgan Chase & Co.
"Thank you. Good morning, Jeremy. ",JPM,20221,7.0,Q,Gerard Cassidy,Analyst,RBC Capital Markets LLC
"Hey, Gerard. ",JPM,20221,7.0,A,Jeremy Barnum,Chief Financial Officer,JPMorgan Chase & Co.
"Can we follow up on your comments about building up the reserves? I think you said it was $902 million that you guys built up, and it was due to high inflation and the war in the Ukraine. How much was it due to inflation? And when you made that comment, is it because you're",JPM,20221,7.0,Q,Gerard Cassidy,Analyst,RBC Capital Markets LLC
concerned about the lower end consumer spending more money for fuel and food that may lead to greater delinquencies down the road? And how much was it due to the Ukraine situation? ,JPM,20221,7.0,Q,Gerard Cassidy,Analyst,RBC Capital Markets LLC
"Yeah, Gerard, it's really a lot more general than that. So just to repeat, 900 build, 300 named specific primarily related to Russia-associated individual names. The other 600 is portfolio level. And as Jamie just said, it simply reflects increasing the probability from a very low probability to a slightly higher probability of a, you might call it, Volcker style Fed induced recession in response to the current inflationary environment, which obviously is in part driven by commodity price increases, which are in part driven by the war in Ukraine, so. But it's not a super micro portfolio level thing except to the extent that our models handle that. It's a top down modification of the probabilistic weights. ",JPM,20221,7.0,A,Jeremy Barnum,Chief Financial Officer,JPMorgan Chase & Co.
One of the things I hated when CECL came out is that we'd spend a lot of time in every call yapping about CECL. I just think it's a huge mistake for all of us to spend too much time on it. ,JPM,20221,7.0,A,Jamie Dimon,Chairman & Chief Executive Officer,JPMorgan Chase & Co.
"Understood. And then as a follow up, Jeremy, if we look at the AOCI number that you gave us, and you were very clear about it, it's going to accrete back into the capital as those securities mature, two things. Is there anything you can do, assuming if the long end of the curve continues to rise and probably giving you maybe a bigger hit on AOCI as we go forward, is there anything you can do to mitigate that, whether to shrink that, the available-for-sale portfolio, which looks like it was $313 billion at the end of this period? Or do you just have to grow the revenue, as you pointed out, as another way of growing your capital? ",JPM,20221,7.0,Q,Gerard Cassidy,Analyst,RBC Capital Markets LLC
"Yeah. I mean, I think that obviously we always try to grow revenue sort of independently of anything else. I think the large point here is, yes, there are some things that can be done to mitigate this, but the big picture is that the central case path is one that gets us to where we want to be when we need to be there in terms of CET1 and leverage. And if things don't play out along the lines of the central case, we have tools and levers available to adjust across a range of dimensions, so. ",JPM,20221,7.0,A,Jamie Dimon,Chairman & Chief Executive Officer,JPMorgan Chase & Co.
Okay. Thank you. ,JPM,20221,7.0,Q,Gerard Cassidy,Analyst,RBC Capital Markets LLC
"Hi. I have a question for both Jeremy and Jamie. Jeremy, I guess the SLR 5.2% close to the minimum, you explained that. But the since quarter end, AOCI probably has gotten worse and I'm guessing your SLR might be very – even closer to that minimum. So I understand your central case, it's fine. Your outlook is good. But at what point do you say – do you stop buybacks? Or do you think you'll buy back maybe half of the $30 billion authorization or does JPMorgan even put on asset caps given just the amazing asset growth over the last three months? So that's my question for Jeremy.",JPM,20221,8.0,Q,Mike Mayo,Analyst,Wells Fargo Securities LLC
"The bigger picture is for you, Jamie. Your CEO letter, the takeaway was in the eyes of the beholder like, oh, Jamie is really worried about a recession this year. No, he's not. So the first question certainly ties into the second. So, Jeremy, plan for buybacks, stopping at asset caps. And then, Jamie, your view of the broader economies and that feeds into your expectations for capital growth. Thank you. ",JPM,20221,8.0,Q,Mike Mayo,Analyst,Wells Fargo Securities LLC
"Okay. Mike, so let me take this capital one. So first of all, let's not talk about asset caps. That's just not a meaningful thing. I think that's a distraction and the terminology is unhelpful. Then in terms of the leverage ratio, just remember that the denominator of that number is so big that it actually takes like pretty big moves to move the ratio. So 5.20% is actually still pretty far away from 5% and of course there are relatively easy to use tools to address that as well, as was alluded to earlier.",JPM,20221,8.0,A,Jeremy Barnum,Chief Financial Officer,JPMorgan Chase & Co.
"In addition, I do think it's worth just reminding everyone of how the ERI restrictions work now relative to how they were at the beginning of the crisis. Just briefly, just to remember that based on the redefinition, if you drop into the regulatory buffer zone, your subject to 60% of restriction which based on our recent historical net income generation still gives us like ample, ample capacity to pay the dividend and so on. So it's obviously not part of the plan, but it's just worth remembering that the cliff effects that we had in there at the beginning of the pandemic are no longer there.",JPM,20221,8.0,A,Jeremy Barnum,Chief Financial Officer,JPMorgan Chase & Co.
"And then in terms of buybacks, just a reminder that the $30 billion authorization is a non-time bounded SEC requirement. It's not the old CCAR standard. So it's just a signal that we want to have that capacity and that flexibility, but it doesn't really say that much about how much we're actually planning to do in the near-term. ",JPM,20221,8.0,A,Jeremy Barnum,Chief Financial Officer,JPMorgan Chase & Co.
"Are you allowed to say what you're planning to do in the near-term like just – like if you're kind of like half the level last year, do you think you can keep that or does it slow down or you're not giving guidance now – ",JPM,20221,8.0,Q,Mike Mayo,Analyst,Wells Fargo Securities LLC
"Yeah. So let's talk about buybacks for a second. In the post-SCB world, we haven't been guiding a lot on the pace of buybacks, mainly because as you know they're at the bottom of our capital stack. So we're focused on investing in the business, providing capital to support growing RWA, acquisitions when they make sense, et cetera, et cetera… and buybacks are an output.",JPM,20221,8.0,A,Jeremy Barnum,Chief Financial Officer,JPMorgan Chase & Co.
"As we have discussed, in the current environment, the rate of buybacks is clearly going to be less than it was in the 2021 period as a result of the interaction of all those effects and that's a good thing. It means that we have better uses for the capital and if things evolve one way or the other, then the rate of buybacks will be an output but it's one of the tools in the toolkit. ",JPM,20221,8.0,A,Jeremy Barnum,Chief Financial Officer,JPMorgan Chase & Co.
"Mike, I would just say… ",JPM,20221,8.0,A,Jamie Dimon,Chairman & Chief Executive Officer,JPMorgan Chase & Co.
Okay. ,JPM,20221,8.0,Q,Mike Mayo,Analyst,Wells Fargo Securities LLC
"...if you look at liquidity and capital, it's extraordinary. And we don't want to have buffers on top of buffers. So we're going to manage this pretty tightly over time. And obviously, when you have AOCI and earnings and CECL, all that, but being conscious of all that. We can manage through that and we've done some acquisitions this year. And so plus, we are adding – we're planning to have more capital for the increase in G-SIFI down the road which reduces stock buyback.",JPM,20221,8.0,A,Jamie Dimon,Chairman & Chief Executive Officer,JPMorgan Chase & Co.
"But the amount – I'd look at the amount of liquidity, the earnings, the capital, all that. That's the stuff that really matters and at the end of the day, it's driving customers. We serve customers which is why we're here. We don't serve managing SLR. That's kind of an output of stuff we do and so – and then your question about – I think it was about recession basically. Yeah... ",JPM,20221,8.0,A,Jamie Dimon,Chairman & Chief Executive Officer,JPMorgan Chase & Co.
Yes. ,JPM,20221,8.0,Q,Mike Mayo,Analyst,Wells Fargo Securities LLC
"...do you want to read the question, Mike. ",JPM,20221,8.0,A,Jeremy Barnum,Chief Financial Officer,JPMorgan Chase & Co.
"Yeah, no, I mean, if you read your CEO letter, that's great. You're the Chief Worry Officer. You're the Chief Risk Manager. You're bringing up all the things that keep you up at night which is great. But you can read it one way and say, hey, Jamie and JPMorgan thinks there's going to be a recession this year. And you can read it another way saying, hey, things are fine but these are some tail risks. So, do you think – and I'll repeat what Glenn said. Your view's better than mine, and I'm not going to accept anything else. You have a lot people, a lot of resources. Do you think the US is going to have a recession this year based on everything you know? ",JPM,20221,8.0,Q,Mike Mayo,Analyst,Wells Fargo Securities LLC
"Yeah. I don't. But I just want to caution this. First of all, I can't forecast the future any more than anyone else. And the Fed forecasts it, and everyone forecasts it, and everyone's wrong all the time. And I think it's a mistake. We run the company to serve clients through thick or thin. That's what we do. We know there are going to be ups, we know there are going to be downs. We know the weather's going to change and a lot of stuff like that.",JPM,20221,8.0,A,Jamie Dimon,Chairman & Chief Executive Officer,JPMorgan Chase & Co.
"But I have pointed out in my letter is very strong underlying growth right now which will go on. It's not stoppable. The consumer has money. They pay down credit card debt. Confidence isn't high, but the fact that they have money, they're spending their money, they have $2 trillion still in the savings and checking accounts. Businesses are in good shape. Home prices are up. Credit is extraordinarily good. So you have this, that's one factor. That's going to continue in the second quarter, third quarter. And after that, it's hard to predict.",JPM,20221,8.0,A,Jamie Dimon,Chairman & Chief Executive Officer,JPMorgan Chase & Co.
"You've got two other very large countervailing factors which you guys are all completely aware of. One is inflation/QT. You've never seen that before. I'm simply pointing out that those are storm clouds on the horizon that may disappear, they may not. That's a fact. And I'm quite conscious of that fact. And I do expect that alone will create volatility and concerns and endless printing and endless headlines and stuff like that.",JPM,20221,8.0,A,Jamie Dimon,Chairman & Chief Executive Officer,JPMorgan Chase & Co.
"And the second is war in Ukraine. I pointed out in my letter that war in Ukraine, usually wars don't necessarily affect the global economy in the short run. But there are exceptions to that. This may very well be one of them. I'm not looking at this on a static basis, okay? So you're looking at this war in Ukraine, and we have sanctions. Things are unpredictable. Wars are unpredictable. Wars have unpredictable outcomes. You've already seen in oil markets, the oil markets are precarious. Okay? So I pointed that out over and over that if people don't understand that those things can change dramatically for either physical reasons, cyber reasons, or just supply/demand.",JPM,20221,8.0,A,Jamie Dimon,Chairman & Chief Executive Officer,JPMorgan Chase & Co.
"And so that's another huge cloud on the horizon. And we're prepared for it. We understand it, we're just, I can't tell you the outcome of it. I hope those things all disappear and go away, we have a soft landing and the war is resolved, okay. I just wouldn't bet on all of that. And of course, being a risk manager, we're going to get through all of that. We're going to serve our clients, and we're going to gain share. We're going to come out of that earning tremendous returns on capital like we have in the past. ",JPM,20221,8.0,A,Jamie Dimon,Chairman & Chief Executive Officer,JPMorgan Chase & Co.
All right. Thank you. ,JPM,20221,8.0,Q,Mike Mayo,Analyst,Wells Fargo Securities LLC
You’re welcome. ,JPM,20221,8.0,A,Jamie Dimon,Chairman & Chief Executive Officer,JPMorgan Chase & Co.
"Good morning. I was hoping you guys could comment on there's some articles on the nickel exposure and how the losses could have been significant if the trades hadn't been canceled and some of the actions that were taken. And just as a follow up, you guys have talked about kind of looking at that business and reevaluating just how you think about some of the outsize risks, and maybe you could update us on that process. ",JPM,20221,9.0,Q,Matt O’Connor,Analyst,Deutsche Bank Securities
"We've already told you, we're helping our clients get through this. We had a little bit lost this quarter. We're going to manage through it. We'll do postmortems on both what we think we did wrong and what the LME could do differently later. We're not going to do it now. ",JPM,20221,9.0,A,Jamie Dimon,Chairman & Chief Executive Officer,JPMorgan Chase & Co.
"And then I guess, I mean, more broadly speaking, given what we just saw where it was probably a several standard deviation event and kind of, as you mentioned, markets might do more of these unusual things like, does it make you step back and look at other portfolios, other businesses and try to reduce... ",JPM,20221,9.0,Q,Matt O’Connor,Analyst,Deutsche Bank Securities
"In my life, I've seen so many ten standard deviation events... ",JPM,20221,9.0,A,Jamie Dimon,Chairman & Chief Executive Officer,JPMorgan Chase & Co.
"Yeah, exactly. ",JPM,20221,9.0,A,Jeremy Barnum,Chief Financial Officer,JPMorgan Chase & Co.
"...you'd be shocked. So obviously, we're aware of that all the time in everything we do. ",JPM,20221,9.0,A,Jamie Dimon,Chairman & Chief Executive Officer,JPMorgan Chase & Co.
"Yeah. And I would take it one step further. I think the whole paradigm of saying it's a ten standard deviation event is naïve, right? We know that returns are not normally distributed. We know that. Regulators know that. The capital framework recognizes that in a broad variety of ways including things like stress VaR. So I don't think – of course you can't predict where and in which asset class and in which particular moment you're going to see these types of fat-tail events, but the framework recognizes in a range of ways that that's the case, and that's how we manage risk, and that's how we're capitalized. ",JPM,20221,9.0,A,Jeremy Barnum,Chief Financial Officer,JPMorgan Chase & Co.
"So we do CCAR once a year, as you guys see. But no, we actually run 100 different various stress tests every week with extreme movements in things. And that's what we do. And you're always going to be a little surprised somewhere, but we're pretty conscious of those risks. And all events like this, we always look at, but it doesn't happen to us. It can happen to someone else. We still analyze everything that maybe we were on the wrong side of something too. But at the end of the day, in all of our businesses, we're here to serve clients all the time. That means taking rational, thoughtful, disciplined risk to do that. ",JPM,20221,9.0,A,Jamie Dimon,Chairman & Chief Executive Officer,JPMorgan Chase & Co.
"And then just separately, you mentioned earlier that you weren't looking to deploy large amounts of your liquidity. And I guess the question is you might get the rate benefit just from Fed funds going up, but is there an opportunity to accelerate that benefit just by moving from cash into shorter-term treasuries? We've obviously had a big move in... ",JPM,20221,9.0,Q,Matt O’Connor,Analyst,Deutsche Bank Securities
"Guys, we're just talking about interest rates going up maybe more than 3%, convexity is going up, AOCI is going up. There are all these various reasons not to do that. We're not going to do it just to give you a little bit more NII next quarter. ",JPM,20221,9.0,A,Jamie Dimon,Chairman & Chief Executive Officer,JPMorgan Chase & Co.
Okay. Thank you. ,JPM,20221,9.0,Q,Matt O’Connor,Analyst,Deutsche Bank Securities
"Hey. Good morning. Maybe you could just talk about how you're thinking about the trajectory of loan growth from here, where you're seeing the biggest pockets of strength. And specifically to cards, is this significant year-over-year growth driven more by slowing pay downs? Or is that increasing demand, or a combination of both? Thanks. ",JPM,20221,10.0,Q,James Mitchell,Analyst,Seaport Global Securities
"Yeah. Sure. So you'll remember in the fourth quarter that we talked about the outlook based on sort of high-single-digit loan growth for the year. And this quarter, we've roughly seen that. Interestingly, it's a little bit more driven by wholesale this quarter, which sort of brings us to your question of Card. So overall, Card loan growth is reasonably robust when you adjust for seasonality and so on. And that's really primarily driven by spend which, as you know, is very robust.",JPM,20221,10.0,A,Jeremy Barnum,Chief Financial Officer,JPMorgan Chase & Co.
"The question inside of that is then what's going on with revolve. And I think our core revolve thesis of getting back to the pre-pandemic levels of revolving balances by the end of the year is still in place to a good approximation. At the margin, we probably saw the take-off moment delayed by six weeks or so because of Omicron. But some of that's reaccelerating now. We see that in some of the March numbers. So we'll see how it goes.",JPM,20221,10.0,A,Jeremy Barnum,Chief Financial Officer,JPMorgan Chase & Co.
