content,bank,quarter,conversation_id,type,speaker_name,speaker_role,speaker_company
"But also just a reminder that there's a very, very close linkage between what we see in revolve and what we see in charge-offs. And so in the moment where revolve is lagging potentially, certainly that was true throughout the pandemic period relative to what we had thought, we also saw exceptionally lower charge-offs. So on a bottom-line basis, the run rate performance, there's significant offset there.",JPM,20221,10.0,A,Jeremy Barnum,Chief Financial Officer,JPMorgan Chase & Co.
"But the core thesis is still there. Spend is robust. We are seeing spend down in some of the cash buffers in the customer segment that tends to revolve, so more or less as anticipated, I would say. ",JPM,20221,10.0,A,Jeremy Barnum,Chief Financial Officer,JPMorgan Chase & Co.
"Okay. And then maybe just skipping over to trading, clearly a stronger quarter, must have finished off strongly in March. So any confirmation of that? And how do we – if you're expecting more volatility around Fed and QT, should we be thinking that this could be a better than normalization year? How are you thinking about trading, I guess, going forward? ",JPM,20221,10.0,Q,James Mitchell,Analyst,Seaport Global Securities
"Yeah. I mean, you know that we're going to be reluctant to like predict the next three quarters of trading performance.",JPM,20221,10.0,A,Jeremy Barnum,Chief Financial Officer,JPMorgan Chase & Co.
,JPM,20221,10.0,A,Jeremy Barnum,Chief Financial Officer,JPMorgan Chase & Co.
Yeah. I could try. ,JPM,20221,10.0,Q,James Mitchell,Analyst,Seaport Global Securities
"I'll just add to that. I cannot foresee any scenario at all where you're not going to have a lot of volatility in markets going forward. We've already spoken about the enormous strength of the economy, QT, inflation, war, commodity prices. There's almost no chance you won't have volatile markets. That could be good or of bad for trading, but there's almost no chance it won't happen and I think people should be prepared for that. ",JPM,20221,10.0,A,Jeremy Barnum,Chief Financial Officer,JPMorgan Chase & Co.
All right. Appreciate the color. ,JPM,20221,10.0,Q,James Mitchell,Analyst,Seaport Global Securities
"Good morning. I guess just one more question on the macro outlook. I guess we can debate whether or not we get into a recession over the next year. But, Jamie, would love to hear your thoughts around as we think about just the medium term, do you see a better CapEx cycle for the US economy? We've heard a lot about reshoring, labor productivity, how companies are dealing with it. Just given the lens you have in terms of large corporates, middle market customers, do you see some pent-up demand for CapEx spending that's going to be a big driver of growth, maybe not for the next six months but as we think about the medium term next few years? ",JPM,20221,11.0,Q,Ebrahim H. Poonawala,Analyst,BofA Securities
"Yes, in general, because as people are spending money and you need to produce more goods and all that, yes, we generally see CapEx going up and I've forgot the exact number. You're better off looking with our great economists forecast for that than asking me. And we see it in the borrowing a little bit. ",JPM,20221,11.0,A,Jamie Dimon,Chairman & Chief Executive Officer,JPMorgan Chase & Co.
"Now, we do see pretty nice loan growth in the Commercial Bank. I mean, there's a bunch of different factors there. It could be some inventory effects and so on, but we'll see, but, yeah. ",JPM,20221,11.0,A,Jeremy Barnum,Chief Financial Officer,JPMorgan Chase & Co.
"And just on that front, like have you seen any improvement in supply chains and how big a setback was the Russian war to supply chain improvements? ",JPM,20221,11.0,Q,Ebrahim H. Poonawala,Analyst,BofA Securities
Very hard to tell. There was some improvement and then there was Ukraine and now it's all mixed again. So it's hard to tell. ,JPM,20221,11.0,A,Jamie Dimon,Chairman & Chief Executive Officer,JPMorgan Chase & Co.
Got it. And just one follow up around you launched the UK digital bank last month. Any early wins in terms of how that's playing out? Any perspective on what the markers are as you think about how that strategy plays out? I'm sure you're going to talk about that at Investor Day but just wondering any early thoughts. ,JPM,20221,11.0,Q,Ebrahim H. Poonawala,Analyst,BofA Securities
Yeah. We’ll leave that to Investor Day. ,JPM,20221,11.0,A,Jamie Dimon,Chairman & Chief Executive Officer,JPMorgan Chase & Co.
Thank you. ,JPM,20221,11.0,Q,Ebrahim H. Poonawala,Analyst,BofA Securities
Hi. Good morning. My questions have been asked and answered. I'll see you guys at Investor Day. ,JPM,20221,12.0,Q,Erika Najarian,Analyst,UBS Securities LLC
"All right. Thanks, Erika. ",JPM,20221,12.0,A,Jeremy Barnum,Chief Financial Officer,JPMorgan Chase & Co.
"Folks, thank you very much. ",JPM,20221,12.0,A,Jamie Dimon,Chairman & Chief Executive Officer,JPMorgan Chase & Co.
Thanks very much. ,JPM,20221,12.0,A,Jeremy Barnum,Chief Financial Officer,JPMorgan Chase & Co.
See you at Investor Day. ,JPM,20221,12.0,A,Jamie Dimon,Chairman & Chief Executive Officer,JPMorgan Chase & Co.
May 23[rd]. ,JPM,20221,12.0,A,Jeremy Barnum,Chief Financial Officer,JPMorgan Chase & Co.
Okay. Bye. ,JPM,20221,12.0,A,Jamie Dimon,Chairman & Chief Executive Officer,JPMorgan Chase & Co.
