content,bank,quarter,conversation_id,type,speaker_name,speaker_role,speaker_company
"So now, if you zoom in on the $6 billion exposure that we now raised as sub-standard or credit-impaired, $1.1 billion is secured with minimal ECLs due to the security held. So then against the remaining $4.9 billion we are holding $1.7 billion of provision, a circa 35% coverage ratio, and within this our coverage ratio against the unsecured credit-impaired exposure is around 55%. We also ran a number of downside scenarios, and I’ve included some of that analysis in the deck, which we can discuss in Q&A, if you wish to, but, to be clear, we did not need to factor those downside scenarios in the 31 December number, and since then our view of the sector has become more positive following the more accommodative policy stance that we’ve been seeing. So we are currently comfortable with our coverage level, but we will continue to monitor the situation very closely.",HSBC,20224,1.0,X,GEORGES ELHEDERY,CHIEF FINANCIAL OFFICER,HSBC
"So I’ll move on to costs now. Fourth quarter operating expenses were up 2% on the same period last year as most of the cost saves were broadly offset by technology spend and higher performance-related pay. The UK bank levy for 2022 was offset by credits from overpayments we made related to prior years. We expect an annual charge of around $200 million for 2023. Rebasing prior year costs at constant currency for hyperinflationary economies – that’s specifically Turkey and Argentina – added around $200 million of cost growth to our adjusted cost base, so around half of the increase when you’re comparing 2022 to 2021.",HSBC,20224,1.0,X,GEORGES ELHEDERY,CHIEF FINANCIAL OFFICER,HSBC
"Our formal cost to achieve transformation programme, what we call the CTA programme, is now complete. We did achieve $5.6 billion of gross cost saves, which was somewhat at the top of our expectations, with an associated cost to achieve spend of $6.5 billion, which was towards the lower end of our guided range. As Noel said, we’re still seeking and finding opportunities to create efficiencies that will deliver sustainable cost saves in future years. The costs thereof will be above the line. We’re now considering up to $300 million of additional costs for severance in 2023. This will enable us to take out further management layers. These costs will be reported in our costs line.",HSBC,20224,1.0,X,GEORGES ELHEDERY,CHIEF FINANCIAL OFFICER,HSBC
"Taking this into account, we’re now aiming for approximately 3% cost growth in 2023, which remains a tough target in a high inflation environment. You should probably expect our 2023 costs to be marginally higher in Q1 as we’re absorbing the run-down of the residual costs from the cost to achieve programme.",HSBC,20224,1.0,X,GEORGES ELHEDERY,CHIEF FINANCIAL OFFICER,HSBC
"I’ll move on to capital now, and the three points I wanted to call out here is, first, our CET1 ratio at 14.2%, up 80 basis points on the previous quarter. This is mainly due to an $8.5 billion capital benefit from higher profits and lower FX-adjusted underlying RWAs. Second, we’re back in our CET1 ratio target operating range, which remains 14% to 14.5% for the medium term. The intention is to manage this range further down from medium to longer term and, given now we have returned to our target operating range six months earlier than we initially indicated, we have brought forward the consideration of future buybacks to the Q1 results.",HSBC,20224,1.0,X,GEORGES ELHEDERY,CHIEF FINANCIAL OFFICER,HSBC
"And, finally, on the proceeds generated by the planned sale of our Canada banking operations, subject to the completion of the transaction, of course, we anticipate three potential uses: one, a special dividend of 21 cents per share, which will be the first priority use; two, we will consider additional buybacks over and above any existing buyback programmes; and, three, we will retain capital as required within the business, and we will update you on these later in the year.",HSBC,20224,1.0,X,GEORGES ELHEDERY,CHIEF FINANCIAL OFFICER,HSBC
"Finally, on guidance, we are reiterating our guidance of at least $36 billion of net interest income for 2023. We remain on track to deliver a return on tangible equity of at least 12% from ’23 onwards and, as I explained, we are now targeting approximately 3% cost growth in 2023. Our capital allocation target for Asia remains unchanged at 50%. Now, given the changes in the macroeconomic environment together with IFRS 17, we do not intend to continue to track",HSBC,20224,1.0,X,GEORGES ELHEDERY,CHIEF FINANCIAL OFFICER,HSBC
"insurance and fees as a percentage of group revenue nor Wealth and Personal Banking as a percentage of group tangible equity. Needless to say, these businesses remain absolutely strategically important and we remain absolutely committed to growing them.",HSBC,20224,1.0,X,GEORGES ELHEDERY,CHIEF FINANCIAL OFFICER,HSBC
"In summary, this was a good set of results. We had revenue growth from all businesses, but we want to further increase and broaden revenues while protecting net interest income. We remain focused on meeting the needs of our customers through high quality propositions and our multi-channel international distribution network. As I said at the beginning, I have three focus areas: supporting the businesses to deliver growth and returns, continuing to generate further efficiencies and the strict cost and capital discipline.",HSBC,20224,1.0,X,GEORGES ELHEDERY,CHIEF FINANCIAL OFFICER,HSBC
"Higher returns in 2023 would give us substantial distribution capacity in the future. A 50% dividend pay-out ratio has been established for 2023 and 2024. We will return to quarterly dividends from quarter 1. Considerations of buybacks have been brought forward to the quarter 1 results and we have signalled a 21 cents per share special dividend as the first priority use of proceeds generated by the planned sale of HSBC Canada, all followed by increased investment in growth and further buybacks in 2024 and 2025, subject of course to continued strong capital levels.",HSBC,20224,1.0,X,GEORGES ELHEDERY,CHIEF FINANCIAL OFFICER,HSBC
"With that, I’ll ask Richard to take us to Q&A. Thank you very much.",HSBC,20224,1.0,X,GEORGES ELHEDERY,CHIEF FINANCIAL OFFICER,HSBC
"RICHARD O’CONNOR, GLOBAL HEAD OF INVESTOR RELATIONS: Thank you, operator, and good morning everyone. As per normal throughout these live events, we’ll take a few questions from the floor to start with and then we’ll go to the telephones and then coming back to the floor. As ever, please give your name and institution. Those in the auditorium, please wait for the mics to come around and please stick to a maximum of two questions per person and, if you’ve got more than that, we’ll obviously try and come around again towards the end of the Q&A session.",HSBC,20224,1.0,X,GEORGES ELHEDERY,CHIEF FINANCIAL OFFICER,HSBC
"With that, I’ll start with Omar and then Martin.",HSBC,20224,1.0,X,GEORGES ELHEDERY,CHIEF FINANCIAL OFFICER,HSBC
Good morning. Thank you for the presentation. I had questions on that net interest income piece. I was wondering if you could talk us a little bit through how the published rate sensitivities have changed versus what was published at the interim results. It looks like there’s been some quite significant changes and it might be impacted by the NII stabilisation programme that you talked about. That would be really helpful.,HSBC,20224,2.0,Q,OMAR KEENAN,Analyst,CREDIT SUISSE
"And then my second question – just when we think about the recommencement of the buyback, given the good capital performance, when we think ahead to the first quarter how should we think about how you’ll manage within the 14-14.5% range? Can we consider that any capital generation that lets the group land north of 14.5% might be, say, paid down to the mid-point, or something like that? But that would be quite helpful. Thanks.",HSBC,20224,2.0,Q,OMAR KEENAN,Analyst,CREDIT SUISSE
"Thanks, Omar, and let me just give a couple of quick comments, before we go into the detail on rate sensitivity, just on NII because, just to reinforce some of the comments that Georges made, our guidance is unchanged quarter to quarter. I think it’s important to keep it pretty consistent, but I do want to emphasise what Georges said. It’s at least $36 billion. We do know the consensus is higher than $36 billion. The consensus currently is around $37 billion.",HSBC,20224,2.0,A,NOEL QUINN,CHIEF EXECUTIVE,HSBC
"Georges said earlier, we’re not looking to move consensus. We’re comfortable with where consensus is. As Georges said, there are three factors that will play out over the next few weeks and months, and they are deposit migration, competitive pressures and foreign exchange. That will determine exactly what we mean by ‘at least’, but we’ll update on that each quarter. I just want to reiterate: we’re not looking to change consensus from its current level in the market.",HSBC,20224,2.0,A,NOEL QUINN,CHIEF EXECUTIVE,HSBC
"And then on the rate sensitivity, Georges, do you want to just explain how that shift has taken place?",HSBC,20224,2.0,A,NOEL QUINN,CHIEF EXECUTIVE,HSBC
"Thanks, Noel. Thanks, Omar. So if you look at the downside 100 basis point shift we are reporting now $4 billion. You may have a record of $6 billion previously. The reduction is mainly due to two factors. Two-thirds of it is due to the rate level changing – obviously the higher the rate, the less you’re compressed by the zero downside challenge –",HSBC,20224,2.0,A,GEORGES ELHEDERY,CHIEF FINANCIAL OFFICER,HSBC
and one-third is due to the additional structural hedging we have started putting on. We’d probably expect that one-third proportion to increase as we go forward.,HSBC,20224,2.0,A,GEORGES ELHEDERY,CHIEF FINANCIAL OFFICER,HSBC
"To look at the upside, the number is $3.5 billion, 100 basis points up. I’d caution you that this number is somewhat theoretical, i.e. we’re assuming 50% betas and no balance sheet change, so no deposit migration, etc. So we know that the real upside for higher rates will be lower than this. It will obviously be higher than where we are today, but lower than the $3.5 billion addition because you have to factor in a natural deposit migration and probably higher betas than 50% at the next juncture of rate increases.",HSBC,20224,2.0,A,GEORGES ELHEDERY,CHIEF FINANCIAL OFFICER,HSBC
"On your second question, we’re not giving an exact target. We’re just stating a range: 14-14.5%. We’re leaving it to our judgement and obviously the relevant approvals to assess what is excess capital beyond that 14%, but 14.5% is not necessarily the lower bound. It’s a range, and therefore it’s not a lower bound at which we judge excess capital.",HSBC,20224,2.0,A,GEORGES ELHEDERY,CHIEF FINANCIAL OFFICER,HSBC
"Good morning. Could I just have one on NII and one on growth? Just in terms of net interest margin, a strong progression again quarter on quarter, both in Hong Kong, so HBAP, and the UK ring-fenced bank. I was just wondering could you give us a steer on how you think of the shape of net interest margins on these two core businesses going forward? Should we expect a broad picture of stability from here, in terms of hedge providing further tailwind, hopefully helping to offset migration, and would you expect the impact of deposit migration to be fairly front-end loaded into 2023 or could this be a longer term process?",HSBC,20224,3.0,Q,MARTIN LEITGEB,Analyst,GOLDMAN SACHS
"And secondly, on growth, the improved and higher profitability outlook as we head into 2023 and some of the disposal proceeds from Canada being earmarked for growth and investment. I was just wondering, what growth opportunities are you most excited about and how to square that up with the guidance for low, single-digit growth this year? Thank you.",HSBC,20224,3.0,Q,MARTIN LEITGEB,Analyst,GOLDMAN SACHS
"Let me deal with the second one first and then Georges can come back and add any flavour on deposit migration. I think with the economic uncertainty that exists around the world at the moment, I think it’s wise to be cautious on expecting too much underlying growth, particularly I think in the demand for term lending from corporates. I think they’re in a cautionary mode at the moment. So that’s why we’re saying we’re not expecting in the near term significant growth, particularly in the demand for term lending. I still think there’s growth potential in working capital finance, trade. A lot will depend on global GDP.",HSBC,20224,3.0,A,NOEL QUINN,CHIEF EXECUTIVE,HSBC
"That’s why we’ve been a little bit more cautious near term, whilst also seeing that, once we get through those uncertainties, there’ll be growth potential beyond that. What I’d also say, though: it’s not equal. It’s not even. We’re seeing a very strong business performance in the Middle East at the moment. We’re seeing good growth there. We’re still gaining market share in mortgages. Granted, the market in the UK has shrunk for mortgages, probably around about 30%, but we’re still seeking to grow market share and we can do so wisely and safely.",HSBC,20224,3.0,A,NOEL QUINN,CHIEF EXECUTIVE,HSBC
"I’m still seeing very strong business activity levels in India. It’s a strong market with good growth potential and Hong Kong has rebounded – not yet translating into demand for term lending from corporates, but we are seeing some early signs in January of Wealth activity starting to increase as the border with mainland China opened up and economic activity in Hong Kong opened. That’s particularly focused more on investors willing to invest in the debt markets and structured products, rather than equity. I think they’re waiting to see how the equity markets move forward.",HSBC,20224,3.0,A,NOEL QUINN,CHIEF EXECUTIVE,HSBC
"We delivered $1 billion of adjusted profit in mainland China last year. So that’s a good outcome and that was in a tough year. So I am expecting an economic rebound in mainland China. It will not be unaffected by the global slowdown. I think we’re well-positioned, if there’s growth in the world, through our Asia franchise, our international franchise and Middle East. We’re wellpositioned, but it’s hard to predict exactly how much growth will be in the economy – so we’ve got to be a bit cautious.",HSBC,20224,3.0,A,NOEL QUINN,CHIEF EXECUTIVE,HSBC
"In terms of linking it to Canada, we’ve been quite clear in our preferred use, our priority use, of the proceeds of Canada. The first priority use will be a special dividend of 21 cents and I think you can understand why we’re doing that. The cancellation of the dividend for our retail shareholders was a significant event a few years ago and we want to try and put that right with",HSBC,20224,3.0,A,NOEL QUINN,CHIEF EXECUTIVE,HSBC
"the Canada transaction once that closes. The balance of the rest of the proceeds between retention and buyback, we haven’t formed a view on at this point in time. We’ll look at that, at the circumstances, when the Canada transaction closes. It will a combination probably of buyback and some retention, but I’m not giving guidance at this stage on what the balance is.",HSBC,20224,3.0,A,NOEL QUINN,CHIEF EXECUTIVE,HSBC
"Georges, do you just want to add any further comments on NII? I’m going to reiterate, for the avoidance of doubt: we’re not seeking to move guidance on NII. We tend not to give guidance on NIM.",HSBC,20224,3.0,A,NOEL QUINN,CHIEF EXECUTIVE,HSBC
"Thanks, Noel. Martin, a couple of comments that probably would help you figure it out. The first one is deposit migration and pass through is already happening, so we’ve already started to see it all the way from Q4. On that point, in Hong Kong the market tracks deposits, term deposits, we’re substantially below the market, but we’re tracking along the same direction. We’ve seen that the market in the UK – we’ve already increased our rates about seven times last year, so it kind of reflects this. So it is already happening.",HSBC,20224,3.0,A,GEORGES ELHEDERY,CHIEF FINANCIAL OFFICER,HSBC
"The second thing I wanted to say is that we haven’t seen such speed in rate hikes and such level of rates for a couple of decades now, which means however much we build and evaluate our forecast on expected customer behaviour and competitive pressures, we don’t know, and this is why we wanted to stay somewhat conservative, but we are conservative for those reasons, to assess that. But, third, I think the proposition we have in both Hong Kong and the UK, since you called out these markets, is leading. Most of our customer deposits are transactional and operating accounts, which means we do expect stronger performance than what you may see as market numbers.",HSBC,20224,3.0,A,GEORGES ELHEDERY,CHIEF FINANCIAL OFFICER,HSBC
"The one thing I just want to call out in Hong Kong to be mindful of is HIBOR, which is obviously a leading indicator of NII performance. Hong Kong has moved all the way to 5.3%, 5.4%, and dropped all the way to 2.4%, where I think they’re on 2.9% today. There is a short-term headwind on NII due to that, but we believe it’s only a short-term headwind due to inflows into Hong Kong and that will resolve itself.",HSBC,20224,3.0,A,GEORGES ELHEDERY,CHIEF FINANCIAL OFFICER,HSBC
"And I think that’s a positive because what’s happening in January, what we’re seeing, is an inflow of capital back into Hong Kong, seeking opportunities for growth. That has temporarily, we believe, suppressed HIBOR a bit, but it’s for a good reason not a bad reason.",HSBC,20224,3.0,A,NOEL QUINN,CHIEF EXECUTIVE,HSBC
"Morning. Hi, Noel. Hi, Georges. I’ve just got a question on revenue, principally around non-interest income. I think you’re selling yourself a little bit short today around the revenue guidance. There’s a lot of focus on net interest income and the $36 billion guide, but my understanding is that that includes a much bigger trading interest expense than the kind of numbers you were calling out in Q3. I think you told us to factor in a great than $1.3 billion drag in 2023, but it looks like that’s annualising much north of $5 billion.",HSBC,20224,4.0,Q,AMAN RAKKAR,Analyst,BARCLAYS
"So it looks like the net interest income that you’re calling out has a much bigger negative in it and I guess the assumption would be that there would be some positive trading income on that trading interest expense, which presumably is a big positive for non-interest income. I wouldn’t want you to audit my spreadsheet, but I think I can get to a non-interest income number that’s somewhere between $25 billion and $26 billion.",HSBC,20224,4.0,Q,AMAN RAKKAR,Analyst,BARCLAYS
"As – I was going to say an ex-accountant. I don’t think you’re ever an exaccountant, but – I’m probably not topical, but I like your double entry. So, yes, there’s a double entry effect and Georges will explain the double entry.",HSBC,20224,4.0,A,NOEL QUINN,CHIEF EXECUTIVE,HSBC
"Your analysis is correct, is the short answer. Just to unpack it a little bit, the earnings from lending to the trading books in Global Banking and Markets are not booked in NII. They’re booked in non-NII, due to the accounting. Those earnings for last year accounted for $2.5 billion in the non-NII line. Of that $2.5 billion, $1.3 billion was generated in Q4 – obviously with the rate level of Q4. With the assumption that the money the bank lends to the trading books in Global Banking and Markets stays where it is today and the rates stay where they are today, then it is not unreasonable to assume you can annualise the Q4 $1.3 billion for the full year 2023 and therefore, yes, you will be a couple of billion up year-onyear on the non-NII part, which is related to funding the trading books.",HSBC,20224,4.0,A,GEORGES ELHEDERY,CHIEF FINANCIAL OFFICER,HSBC
"So good analysis, fair observation and the – because non-interest income is a messy line – I know you’ve got IFRS 17 which you’re going to come back to us on. Can you help us understand, year-on-year, the two big drivers of fee income, GB&M and Wealth Management? Is your best guess GB&M is up year-on-year? What’s your best take on the underlying theme coming to the business year-on-year?",HSBC,20224,4.0,Q,AMAN RAKKAR,Analyst,BARCLAYS
"First of all, on GB&M, I think we, as probably the market, have seen a strong level of activity in January. That’s been particularly so in Debt Capital Markets, but we’ve seen a strong January. Will that sustain through the year is too early to predict, but good activity, good pipeline. On Wealth, I said earlier I think we’re seeing some early signs of Wealth having a positive January in Hong Kong in particular. One should assume that positiveness should accelerate, but it’s hard to know exactly by what rate, and I think equities will – equity investment will lag investment in the bond markets and the debt markets, but I think they’re going to be the two drivers.",HSBC,20224,4.0,A,NOEL QUINN,CHIEF EXECUTIVE,HSBC
"We’re going to keep with the theme from growth in global payments and foreign exchange and trade. That’s that bedrock that we had last year, that’s grown around CAGRs of 6%, 7%, 8% per annum for the past three years will continue. We’re not going to lessen our focus on that, but it should be supplemented by greater levels of activity in GB&M and in Wealth.",HSBC,20224,4.0,A,NOEL QUINN,CHIEF EXECUTIVE,HSBC
"We’re not guiding towards fee income but, if you unpack it, every component of fee income is an area of strategic focus on growth so, subject to market conditions, you know where our investments are going, and fee income earning businesses are a clear priority, as Noel was indicating earlier.",HSBC,20224,4.0,A,GEORGES ELHEDERY,CHIEF FINANCIAL OFFICER,HSBC
"Thank you. I guess I’ll carry on working down the P&L, so one on costs and one on provisions. Previously on the cost guidance, you talked about this $1 billion of cost saves at 3%, 5% inflation, net 2%, and now today there’s the $300 million severance, taking you up to 3% cost growth. Just thinking more about the medium term, your messaging was ‘no easing up on cost discipline and saves’, but obviously the severance charges are somewhat lower than the CTA that you booked last year.",HSBC,20224,5.0,Q,ANDREW COOMBS,Analyst,CITI
"So, presumably, the attached cost savings are going to be lower than what you had as a tailwind following through into this year. So when we think about the cost base in the medium term and the underlying growth run rate, obviously inflation dependent, but do you see it slightly higher than 3% or do you think 3% is a medium term run rate?",HSBC,20224,5.0,Q,ANDREW COOMBS,Analyst,CITI
"We’re not giving guidance on 2024 costs at this point in time. I think it’s too early. I think we’ve got to see where we go to on the inflation curve for the rest of the year. There’s good progress on inflation, but it’s still unpredictable. On your point, which I do want to come back on, our investment in technology continues. We’re now at 20% of our total cost base in tech. That technology is improving customer propositions, but it’s also improving processes, digitising processes more and more. We have a long-term programme of cost takeout over the future years – 2023, 2024 and 2025. That’s already underway. From the IT investment that’s already embedded in our plan, that will generate cost savings on a recurring basis as we digitise.",HSBC,20224,5.0,A,NOEL QUINN,CHIEF EXECUTIVE,HSBC
"So I don’t always need severance to get cost savings, because I’ve got IT investment to give me some cost savings and that is going to be continuing. Clearly, the more notice you have on that, the more ability you have to achieve that without severance because you can do natural attrition. Typically, the attrition rate in processing centres and in much of the cost base could be 10-15% per annum. Some places could be as high as 20% per annum attrition. So you have lead time ability to reposition your headcount without the need for severance as those processes are re-engineered, and we’re going to be doing more of that going forward and therefore not have to call on things like CTA in the quantum we called on it in the past three years.",HSBC,20224,5.0,A,NOEL QUINN,CHIEF EXECUTIVE,HSBC
And I want to forget CTA. That’s now history and we’re just embedding cost savings as part of the fundamental architecture of the business going forward. Hopefully that’s answered your question on cost.,HSBC,20224,5.0,A,NOEL QUINN,CHIEF EXECUTIVE,HSBC
"And then on provisions, thank you for providing the additional disclosure around Chinese commercial real estate. The $1 billion plausible downside that you provided",HSBC,20224,5.0,Q,ANDREW COOMBS,Analyst,CITI
"on the Hong Kong booked Chinese commercial real estate positions, just so we have an understanding, you talk about that as plausible downside. Is that, or isn’t that akin to your overall 40 basis points guidance? Is it the 40 that’s the base case without that $1 billion?",HSBC,20224,5.0,Q,ANDREW COOMBS,Analyst,CITI
"Let me give you an opening comment and then Georges can add some flavour. We ran that plausible downside as at 31 December without knowledge or the benefit of the positive policy moves that took place in January. So it’s a like-for-like. We topped up the provisions. We thought the provisions were appropriate. We decided to do some scenario analysis. That’s the result of the scenario analysis. We didn’t think that scenario required to be provided against, or we would have put it in the balance sheet. We decided that was not required.",HSBC,20224,5.0,A,NOEL QUINN,CHIEF EXECUTIVE,HSBC
